{
  "$schema": "https://json-schema.org/draft/2020-12/schema",
  "$id": "https://github.com/Yuqing-Cai/cn-failure-atlas/raw/main/taxonomy.schema.json",
  "title": "中文虚构对话失败图谱 v2",
  "description": "将可观察症状、因果假设、复合现象与不确定性标记分开表达的机器可读诊断本体。",
  "type": "object",
  "required": [
    "schema_version",
    "taxonomy_version",
    "status",
    "updated_at",
    "name",
    "description",
    "diagnostic_order",
    "total_items",
    "item_counts",
    "layers",
    "causal_hypotheses",
    "composite_tags",
    "uncertainty_markers"
  ],
  "additionalProperties": false,
  "properties": {
    "schema_version": { "const": "2.0.0" },
    "taxonomy_version": { "type": "string", "pattern": "^[0-9]+\\.[0-9]+\\.[0-9]+(?:-[0-9A-Za-z.-]+)?$" },
    "status": { "type": "string", "enum": ["experimental", "stable", "deprecated"] },
    "updated_at": { "type": "string", "format": "date" },
    "name": { "$ref": "#/$defs/non_empty_string" },
    "description": { "$ref": "#/$defs/non_empty_string" },
    "diagnostic_order": {
      "type": "array",
      "prefixItems": [
        { "const": "I" },
        { "const": "II" },
        { "const": "III" },
        { "const": "IV" },
        { "const": "V" }
      ],
      "items": false,
      "minItems": 5,
      "maxItems": 5
    },
    "total_items": { "type": "integer", "minimum": 1 },
    "item_counts": {
      "type": "object",
      "required": ["symptoms", "causal_hypotheses", "composites", "uncertainty_markers"],
      "additionalProperties": false,
      "properties": {
        "symptoms": { "type": "integer", "minimum": 1 },
        "causal_hypotheses": { "type": "integer", "minimum": 0 },
        "composites": { "type": "integer", "minimum": 0 },
        "uncertainty_markers": { "type": "integer", "minimum": 0 }
      }
    },
    "layers": {
      "type": "array",
      "items": { "$ref": "#/$defs/layer" },
      "minItems": 5,
      "maxItems": 5
    },
    "causal_hypotheses": { "type": "array", "items": { "$ref": "#/$defs/causal_hypothesis" } },
    "composite_tags": { "type": "array", "items": { "$ref": "#/$defs/auxiliary_item" } },
    "uncertainty_markers": { "type": "array", "items": { "$ref": "#/$defs/auxiliary_item" } }
  },
  "$defs": {
    "non_empty_string": { "type": "string", "minLength": 1 },
    "identifier": { "type": "string", "pattern": "^[a-z][a-z0-9_]*$" },
    "layer": {
      "type": "object",
      "required": ["id", "name", "description", "subcategories"],
      "additionalProperties": false,
      "properties": {
        "id": { "type": "string", "enum": ["I", "II", "III", "IV", "V"] },
        "name": { "$ref": "#/$defs/non_empty_string" },
        "description": { "$ref": "#/$defs/non_empty_string" },
        "note": { "$ref": "#/$defs/non_empty_string" },
        "subcategories": {
          "type": "array",
          "items": { "$ref": "#/$defs/subcategory" },
          "minItems": 1
        }
      }
    },
    "subcategory": {
      "type": "object",
      "required": ["id", "name", "labels"],
      "additionalProperties": false,
      "properties": {
        "id": { "type": "string", "pattern": "^(?:I|II|III|IV|V)-[A-Z]$" },
        "name": { "$ref": "#/$defs/non_empty_string" },
        "labels": {
          "type": "array",
          "items": { "$ref": "#/$defs/symptom" },
          "minItems": 1
        }
      }
    },
    "symptom": {
      "type": "object",
      "required": ["id", "name", "definition", "derived_from", "criteria", "observability"],
      "additionalProperties": false,
      "properties": {
        "id": { "$ref": "#/$defs/identifier" },
        "name": { "$ref": "#/$defs/non_empty_string" },
        "definition": { "$ref": "#/$defs/non_empty_string" },
        "derived_from": {
          "oneOf": [
            {
              "type": "array",
              "items": { "$ref": "#/$defs/identifier" },
              "minItems": 1,
              "uniqueItems": true
            },
            { "type": "null" }
          ]
        },
        "criteria": {
          "type": "array",
          "items": { "$ref": "#/$defs/non_empty_string" },
          "minItems": 1,
          "uniqueItems": true
        },
        "observability": {
          "type": "string",
          "enum": ["high", "medium", "low"],
          "description": "定义给出的证据在输出中被直接观察到的预期难易，不是一次诊断的置信度。"
        },
        "example": { "$ref": "#/$defs/non_empty_string" }
      }
    },
    "causal_hypothesis": {
      "type": "object",
      "required": ["id", "name", "primary_layer", "definition"],
      "additionalProperties": false,
      "properties": {
        "id": { "$ref": "#/$defs/identifier" },
        "name": { "$ref": "#/$defs/non_empty_string" },
        "primary_layer": { "type": "string", "pattern": "^(?:I|II|III|IV|V)(?:-(?:I|II|III|IV|V))?$" },
        "definition": { "$ref": "#/$defs/non_empty_string" }
      }
    },
    "auxiliary_item": {
      "type": "object",
      "required": ["id", "name", "definition", "example"],
      "additionalProperties": false,
      "properties": {
        "id": { "$ref": "#/$defs/identifier" },
        "name": { "$ref": "#/$defs/non_empty_string" },
        "definition": { "$ref": "#/$defs/non_empty_string" },
        "example": { "$ref": "#/$defs/non_empty_string" }
      }
    }
  }
}
