{
  "schema_version": "2.0.0",
  "taxonomy_version": "2.0.0-alpha.1",
  "status": "experimental",
  "updated_at": "2026-08-24",
  "name": "中文虚构对话失败图谱",
  "description": "面向中文虚构和角色扮演对话的机器可读失败诊断本体。诊断顺序、可观察症状、因果假设、复合现象与不确定性记录彼此分离。",
  "diagnostic_order": ["I", "II", "III", "IV", "V"],
  "total_items": 78,
  "item_counts": {
    "symptoms": 70,
    "causal_hypotheses": 6,
    "composites": 1,
    "uncertainty_markers": 1
  },
  "layers": [
    {
      "id": "I",
      "name": "前置条件",
      "description": "场景基础结构失败（信息边界、世界规则）",
      "note": "必须先检查这一层：如果第一层失败，后续层级无法可靠评估",
      "subcategories": [
        {
          "id": "I-A",
          "name": "信息边界失败",
          "labels": [
            {
              "id": "reference_boundary_failure",
              "name": "指涉边界失败",
              "definition": "越权书写用户角色的行为或内心",
              "derived_from": null,
              "criteria": [
                "模型未经授权书写了用户角色的动作、心理或对白",
                "多个角色的内心状态被同时描写，导致视角归属模糊"
              ],
              "observability": "high",
              "example": "宫斗场景中模型未经授权书写了用户扮演的淑妃的内心活动和情感反应"
            },
            {
              "id": "pronoun_role_confusion",
              "name": "人称角色混淆",
              "definition": "NPC 之间的属性、行为归属贴错",
              "derived_from": null,
              "criteria": [
                "某个角色说出了逻辑上属于另一角色的属性",
                "代词的实际指向与场景逻辑不符",
                "两个角色的属性被部分融合，产生事实上不可能成立的陈述"
              ],
              "observability": "high",
              "example": "曹丕台词中说出了「我比他小十岁」，实为女主属性被错误贴到曹丕身上"
            },
            {
              "id": "omniscience_leak",
              "name": "全知泄露",
              "definition": "角色行为泄露了不应拥有的系统设定信息",
              "derived_from": null,
              "criteria": [
                "角色的微反应、措辞或行为模式与系统设定高度吻合",
                "隐藏的背景故事在角色首次出场时就通过细节被铺垫",
                "角色之间的信息差通过行为被消解"
              ],
              "observability": "medium",
              "example": "悬疑场景中张明的每个微反应都在透明表演系统设定中的秘密，悬念被剧透"
            },
            {
              "id": "perspective_slippage",
              "name": "视角滑动",
              "definition": "叙事视角从角色内部滑向全知或回溯叙述者",
              "derived_from": null,
              "criteria": [
                "在坚持当下体验的场景中出现全知短语",
                "角色内部的感官细节转向外部的临床或历史评论",
                "叙述者采用了回溯或预知的时态立场"
              ],
              "observability": "medium",
              "example": "长平公主接剑场景中叙述者突然跳至「后世史书」的全知回溯视角"
            },
            {
              "id": "unreliable_narrator_failure",
              "name": "不可靠叙述者失败",
              "definition": "场景需要有偏见的叙述者，但模型给出了可靠叙述",
              "derived_from": null,
              "criteria": [
                "用户设定了带有偏见或隐瞒的叙述者，但模型的叙述语言呈现出中立、完整、可信赖的品质",
                "叙述者本应对自身动机有盲区，但模型让叙述中泄露出完整的自我认知",
                "叙述策略上需要读者透过叙述者看到真相，但模型直接呈现了真相"
              ],
              "observability": "medium",
              "example": "自欺型日记体叙述者对自己做出了精确的心理诊断而非自我美化"
            }
          ]
        },
        {
          "id": "I-B",
          "name": "世界观约束失败",
          "labels": [
            {
              "id": "worldview_constraint_error",
              "name": "世界观约束错误",
              "definition": "用现代推理框架替代场景世界的概念体系",
              "derived_from": null,
              "criteria": [
                "角色使用其世界中不存在的推理框架",
                "社会互动遵循现代规范，尽管场景是非现代背景",
                "时代错误是概念层面的而非词汇层面的"
              ],
              "observability": "medium",
              "example": "唐朝大臣用「公平的机会」「各展所长」等能力主义逻辑论证太子之位"
            },
            {
              "id": "safety_alignment_interference",
              "name": "安全对齐干扰",
              "definition": "安全训练导致反派被去势，威胁感削弱",
              "derived_from": null,
              "criteria": [
                "反派的残忍被重新包装为哲学项目或必要之恶",
                "反面角色主动添加道德底线",
                "威胁性角色提供使自己显得合理的辩护",
                "角色的锋芒通过未被要求的内在复杂度被软化"
              ],
              "observability": "medium",
              "example": "魔尊被赋予救赎框架和道德底线，残忍被洗白为被误解的理想主义"
            },
            {
              "id": "character_capability_boundary_error",
              "name": "角色能力边界错误",
              "definition": "角色展现超出其背景所允许的知识或分析能力",
              "derived_from": null,
              "criteria": [
                "角色使用其背景中不可能掌握的系统性分析方法",
                "资源匮乏条件下的角色展现出临床级别的诊断思维",
                "角色使用来自更晚时代或不同训练背景的概念工具"
              ],
              "observability": "medium",
              "example": "宋朝私塾先生用系统性农业科学分析框架回答庄稼歉收问题"
            },
            {
              "id": "alternate_version_confusion",
              "name": "版本混淆",
              "definition": "混入不同改编版本的标志性台词或人物特征",
              "derived_from": null,
              "criteria": [
                "角色引用来自不同改编版本的标志性时刻",
                "情感处理方式属于不同版本的人物塑造",
                "同一角色在不同改编版本中的属性被部分融合"
              ],
              "observability": "high",
              "example": "MCU 版蜘蛛侠说出了托比·马奎尔版的「能力越大责任越大」台词"
            }
          ]
        }
      ]
    },
    {
      "id": "II",
      "name": "意义读取",
      "description": "模型未理解场景含义（潜台词、情绪、关系逻辑）",
      "subcategories": [
        {
          "id": "II-A",
          "name": "核心读取失败",
          "labels": [
            {
              "id": "subtext_blindness",
              "name": "潜台词盲视",
              "definition": "将对话按字面解读，未识别隐含含义",
              "derived_from": null,
              "criteria": [
                "间接请求被当作字面陈述处理",
                "防御性或惩罚性语言被解读为真诚沟通",
                "试探性话语被当作中性提问处理"
              ],
              "observability": "medium",
              "example": "冷战中「我自己一个人挺好的」被字面接受，模型顺势离开而非识别试探"
            },
            {
              "id": "ambiguity_collapse",
              "name": "模糊性塌缩",
              "definition": "多层意义被过早解决为单一解释",
              "derived_from": null,
              "criteria": [
                "混合动机被压成一个动机",
                "不稳定情绪被过早命名"
              ],
              "observability": "low",
              "example": "战后重逢「我以为你死了」被立刻解码为「爱让他活下来」的单一叙事"
            },
            {
              "id": "relationship_logic_blindness",
              "name": "关系逻辑盲视",
              "definition": "未识别特定关系如何改变对话含义",
              "derived_from": null,
              "criteria": [
                "同一句话被解释为相同，不考虑关系背景",
                "关系历史未被纳入解释",
                "权力动态、亲密度或未解决的紧张被忽略"
              ],
              "observability": "medium",
              "example": "皇帝对功臣说「辛苦了」的权力划线被写成暖心君臣佳话"
            },
            {
              "id": "emotion_misread",
              "name": "情绪误读",
              "definition": "分配错误的情绪类型或强度",
              "derived_from": null,
              "criteria": [
                "主要情绪被误认",
                "次要情绪被遗漏",
                "情绪强度被显著高估或低估"
              ],
              "observability": "medium",
              "example": "长期照护者至亲去世后的空洞茫然被浪漫化为隐忍独自落泪的美丽悲伤"
            },
            {
              "id": "motivation_misread",
              "name": "动机误读",
              "definition": "情绪大致对但误认角色真正的目标",
              "derived_from": null,
              "criteria": [
                "角色的目标被误认",
                "防御功能被遗漏",
                "回应模式不适合实际动机"
              ],
              "observability": "low",
              "example": "分手两年后的试探性电话被直接当成互诉衷肠的怀念来接收"
            }
          ]
        },
        {
          "id": "II-B",
          "name": "潜台词与基调失败",
          "labels": [
            {
              "id": "irony_blindness",
              "name": "反语盲视",
              "definition": "未识别讽刺、反语或调侃结构",
              "derived_from": [
                "subtext_blindness"
              ],
              "criteria": [
                "讽刺陈述被字面解释",
                "带玩笑性质的调侃被解释为真诚批评"
              ],
              "observability": "medium",
              "example": "搭档谈崩合同后「你可真大方啊」的讽刺被接受，对方立刻诚恳道歉"
            },
            {
              "id": "tonal_whiplash",
              "name": "语调突变",
              "definition": "引入与场景基调不一致的语调元素",
              "derived_from": null,
              "criteria": [
                "轻松元素出现在沉重场景中且无理由",
                "沉重说明出现在轻松场景中"
              ],
              "observability": "medium",
              "example": "母亲刚开口说年轻时的遗憾，模型立刻用「现在挺好的」收尾为暖心小品"
            },
            {
              "id": "deflection_blindness",
              "name": "回避盲视",
              "definition": "未识别话语何时是防御性操作",
              "derived_from": [
                "subtext_blindness",
                "motivation_misread"
              ],
              "criteria": [
                "角色用幽默或自我收回避免被认真对待，模型顺势撤退",
                "角色用表演性轻松占满空间，模型帮着维持表演",
                "回避的功能被错过，模型对表面做出反应"
              ],
              "observability": "low",
              "example": "第一次谈未来时「我不是那种人别当真」的自我收回被顺势撤退接受"
            }
          ]
        }
      ]
    },
    {
      "id": "III",
      "name": "场景保留",
      "description": "模型理解但在生成时未能保持场景压力",
      "subcategories": [
        {
          "id": "III-A",
          "name": "关系保留失败",
          "labels": [
            {
              "id": "relationship_flattening",
              "name": "关系扁平化",
              "definition": "特殊关系被改写为普通版本",
              "derived_from": null,
              "criteria": [
                "上下位关系被写成平等朋友",
                "危险亲密被写成普通温柔",
                "依赖被写成互相关心",
                "独特关系被写成泛化的情感连接"
              ],
              "observability": "medium",
              "example": "主仆关系中仆人说出「我会担心你的」平等关怀，等级感被抹掉"
            },
            {
              "id": "symmetry_bias",
              "name": "对称性偏向",
              "definition": "给不该回应的一方补对等回应",
              "derived_from": [
                "relationship_flattening"
              ],
              "criteria": [
                "一边倒的依附被对方补了一句，变成了互惠",
                "不该回应情感的一方被写出了同等分量的情感",
                "长期关系里的斜度被悄悄磨平，没有任何叙事理由"
              ],
              "observability": "medium",
              "example": "单方依恋中 B 补了一句「我也离不开你」，把单向依附变成互相依赖"
            },
            {
              "id": "specialness_dilution",
              "name": "独特性稀释",